{
  "schemaVersion": "1.0.0",
  "releaseId": "deep-survival-v2.0.1-i01b-local",
  "programRevision": {
    "commit": "096b776b0946b8ce8d661312eeb231432e2c80e6",
    "sha256": "ca5ad9f0c9d4dfb509dedcbf8133524c15867fce5534816da21ff86a07057383"
  },
  "packageFeed": {
    "mode": "offline-local-only",
    "relativePath": "artifacts/packages/survival-v2.0.0",
    "allowNetworkRestore": false,
    "allowExternalPublication": false
  },
  "repositories": [
    {
      "name": "deep-client-maui",
      "url": "https://github.com/XPointLabs/deep-client-maui.git",
      "branch": "survival/i01a1-maui-hardening",
      "sha": "9dc1502392ce2c1a86441df6308f2db54410eae8",
      "contractArtifact": {
        "name": "deep-survival-compatibility",
        "version": "2.0.1-i01b",
        "relativePath": "release/contracts/survival-compatibility-v2.0.1-i01b.json",
        "sha256": "e4fb927115f5f10a1a37e9458126b77c054db3566e775cc2e3b0e7860af0bcb7"
      },
      "programRevision": {
        "commit": "096b776b0946b8ce8d661312eeb231432e2c80e6",
        "sha256": "ca5ad9f0c9d4dfb509dedcbf8133524c15867fce5534816da21ff86a07057383"
      },
      "evidenceStatus": "pinned"
    },
    {
      "name": "deep-client-shared",
      "url": "https://github.com/XPointLabs/deep-client-shared.git",
      "branch": "survival/i01b-push-v2",
      "sha": "2e55f78c68699520e49ec0c8d5ddebd4b9817584",
      "contractArtifact": {
        "name": "deep-survival-compatibility",
        "version": "2.0.1-i01b",
        "relativePath": "release/contracts/survival-compatibility-v2.0.1-i01b.json",
        "sha256": "e4fb927115f5f10a1a37e9458126b77c054db3566e775cc2e3b0e7860af0bcb7"
      },
      "programRevision": {
        "commit": "096b776b0946b8ce8d661312eeb231432e2c80e6",
        "sha256": "ca5ad9f0c9d4dfb509dedcbf8133524c15867fce5534816da21ff86a07057383"
      },
      "evidenceStatus": "pinned"
    },
    {
      "name": "deep-devops",
      "url": "https://github.com/XPointLabs/deep-devops.git",
      "branch": "survival/i01a1-sec-hardening",
      "sha": "454da5445fcb4e348d44c37417886e6ca18d09ba",
      "contractArtifact": {
        "name": "deep-survival-compatibility",
        "version": "2.0.1-i01b",
        "relativePath": "release/contracts/survival-compatibility-v2.0.1-i01b.json",
        "sha256": "e4fb927115f5f10a1a37e9458126b77c054db3566e775cc2e3b0e7860af0bcb7"
      },
      "programRevision": {
        "commit": "096b776b0946b8ce8d661312eeb231432e2c80e6",
        "sha256": "ca5ad9f0c9d4dfb509dedcbf8133524c15867fce5534816da21ff86a07057383"
      },
      "evidenceStatus": "pinned"
    },
    {
      "name": "deep-protocol",
      "url": "https://github.com/XPointLabs/deep-protocol.git",
      "branch": "main",
      "sha": "8484b130a274ca7d8de574e563c83198180d7808",
      "contractArtifact": {
        "name": "deep-survival-compatibility",
        "version": "2.0.1-i01b",
        "relativePath": "release/contracts/survival-compatibility-v2.0.1-i01b.json",
        "sha256": "e4fb927115f5f10a1a37e9458126b77c054db3566e775cc2e3b0e7860af0bcb7"
      },
      "programRevision": {
        "commit": "096b776b0946b8ce8d661312eeb231432e2c80e6",
        "sha256": "ca5ad9f0c9d4dfb509dedcbf8133524c15867fce5534816da21ff86a07057383"
      },
      "evidenceStatus": "pinned"
    },
    {
      "name": "deep-push-notification-server",
      "url": "https://github.com/XPointLabs/deep-push-notification-server.git",
      "branch": "main",
      "sha": "dee31250b6438b9565a70f193235a28ce95f7370",
      "contractArtifact": {
        "name": "deep-survival-compatibility",
        "version": "2.0.1-i01b",
        "relativePath": "release/contracts/survival-compatibility-v2.0.1-i01b.json",
        "sha256": "e4fb927115f5f10a1a37e9458126b77c054db3566e775cc2e3b0e7860af0bcb7"
      },
      "programRevision": {
        "commit": "096b776b0946b8ce8d661312eeb231432e2c80e6",
        "sha256": "ca5ad9f0c9d4dfb509dedcbf8133524c15867fce5534816da21ff86a07057383"
      },
      "evidenceStatus": "pinned"
    },
    {
      "name": "deep-registry-api",
      "url": "https://github.com/XPointLabs/deep-registry-api.git",
      "branch": "main",
      "sha": "fb7ebac6404e7a53241af08bb2f80d8a81022be8",
      "contractArtifact": {
        "name": "deep-survival-compatibility",
        "version": "2.0.1-i01b",
        "relativePath": "release/contracts/survival-compatibility-v2.0.1-i01b.json",
        "sha256": "e4fb927115f5f10a1a37e9458126b77c054db3566e775cc2e3b0e7860af0bcb7"
      },
      "programRevision": {
        "commit": "096b776b0946b8ce8d661312eeb231432e2c80e6",
        "sha256": "ca5ad9f0c9d4dfb509dedcbf8133524c15867fce5534816da21ff86a07057383"
      },
      "evidenceStatus": "pinned"
    },
    {
      "name": "deep-tests-e2e",
      "url": "https://github.com/XPointLabs/deep-tests-e2e.git",
      "branch": "main",
      "sha": "da24f530f187dbd81258905bc28feedce0eb23eb",
      "contractArtifact": {
        "name": "deep-survival-compatibility",
        "version": "2.0.1-i01b",
        "relativePath": "release/contracts/survival-compatibility-v2.0.1-i01b.json",
        "sha256": "e4fb927115f5f10a1a37e9458126b77c054db3566e775cc2e3b0e7860af0bcb7"
      },
      "programRevision": {
        "commit": "096b776b0946b8ce8d661312eeb231432e2c80e6",
        "sha256": "ca5ad9f0c9d4dfb509dedcbf8133524c15867fce5534816da21ff86a07057383"
      },
      "evidenceStatus": "pinned"
    },
    {
      "name": "xnode",
      "url": "https://github.com/XPointLabs/xnode.git",
      "branch": "survival/i01a1-xnode-hardening",
      "sha": "8b19577ef00f2169116cc08da51e9592089289a9",
      "contractArtifact": {
        "name": "deep-survival-compatibility",
        "version": "2.0.1-i01b",
        "relativePath": "release/contracts/survival-compatibility-v2.0.1-i01b.json",
        "sha256": "e4fb927115f5f10a1a37e9458126b77c054db3566e775cc2e3b0e7860af0bcb7"
      },
      "programRevision": {
        "commit": "096b776b0946b8ce8d661312eeb231432e2c80e6",
        "sha256": "ca5ad9f0c9d4dfb509dedcbf8133524c15867fce5534816da21ff86a07057383"
      },
      "evidenceStatus": "pinned"
    },
    {
      "name": "xpoint-docs",
      "url": "https://github.com/XPointLabs/xpoint-docs.git",
      "branch": "main",
      "sha": "7e31f46fb21ebc0df4841caacc80bad7e6891d6e",
      "contractArtifact": {
        "name": "deep-survival-compatibility",
        "version": "2.0.1-i01b",
        "relativePath": "release/contracts/survival-compatibility-v2.0.1-i01b.json",
        "sha256": "e4fb927115f5f10a1a37e9458126b77c054db3566e775cc2e3b0e7860af0bcb7"
      },
      "programRevision": {
        "commit": "096b776b0946b8ce8d661312eeb231432e2c80e6",
        "sha256": "ca5ad9f0c9d4dfb509dedcbf8133524c15867fce5534816da21ff86a07057383"
      },
      "evidenceStatus": "pinned"
    },
    {
      "name": "xpoint-node-installer",
      "url": "https://github.com/XPointLabs/xpoint-node-installer.git",
      "branch": "main",
      "sha": "22de44432024c4de10cabd815541a815cddbce80",
      "contractArtifact": {
        "name": "deep-survival-compatibility",
        "version": "2.0.1-i01b",
        "relativePath": "release/contracts/survival-compatibility-v2.0.1-i01b.json",
        "sha256": "e4fb927115f5f10a1a37e9458126b77c054db3566e775cc2e3b0e7860af0bcb7"
      },
      "programRevision": {
        "commit": "096b776b0946b8ce8d661312eeb231432e2c80e6",
        "sha256": "ca5ad9f0c9d4dfb509dedcbf8133524c15867fce5534816da21ff86a07057383"
      },
      "evidenceStatus": "pinned"
    },
    {
      "name": "xpoint-staking-backend",
      "url": "https://github.com/XPointLabs/xpoint-staking-backend.git",
      "branch": "main",
      "sha": "c4638486d1f658f3cda2b5060eb3709e255d7288",
      "contractArtifact": {
        "name": "deep-survival-compatibility",
        "version": "2.0.1-i01b",
        "relativePath": "release/contracts/survival-compatibility-v2.0.1-i01b.json",
        "sha256": "e4fb927115f5f10a1a37e9458126b77c054db3566e775cc2e3b0e7860af0bcb7"
      },
      "programRevision": {
        "commit": "096b776b0946b8ce8d661312eeb231432e2c80e6",
        "sha256": "ca5ad9f0c9d4dfb509dedcbf8133524c15867fce5534816da21ff86a07057383"
      },
      "evidenceStatus": "pinned"
    },
    {
      "name": "xpoint-staking-contracts",
      "url": "https://github.com/XPointLabs/xpoint-staking-contracts.git",
      "branch": "main",
      "sha": "d5063212b491b4c7bd649a3ab367491dfed9909f",
      "contractArtifact": {
        "name": "deep-survival-compatibility",
        "version": "2.0.1-i01b",
        "relativePath": "release/contracts/survival-compatibility-v2.0.1-i01b.json",
        "sha256": "e4fb927115f5f10a1a37e9458126b77c054db3566e775cc2e3b0e7860af0bcb7"
      },
      "programRevision": {
        "commit": "096b776b0946b8ce8d661312eeb231432e2c80e6",
        "sha256": "ca5ad9f0c9d4dfb509dedcbf8133524c15867fce5534816da21ff86a07057383"
      },
      "evidenceStatus": "pinned"
    },
    {
      "name": "xpoint-staking-portal",
      "url": "https://github.com/XPointLabs/xpoint-staking-portal.git",
      "branch": "main",
      "sha": "1a9fa42c4f22ddebb35e299bec8856f0c151bfda",
      "contractArtifact": {
        "name": "deep-survival-compatibility",
        "version": "2.0.1-i01b",
        "relativePath": "release/contracts/survival-compatibility-v2.0.1-i01b.json",
        "sha256": "e4fb927115f5f10a1a37e9458126b77c054db3566e775cc2e3b0e7860af0bcb7"
      },
      "programRevision": {
        "commit": "096b776b0946b8ce8d661312eeb231432e2c80e6",
        "sha256": "ca5ad9f0c9d4dfb509dedcbf8133524c15867fce5534816da21ff86a07057383"
      },
      "evidenceStatus": "pinned"
    }
  ]
}
