{
  "schemaVersion": "1.0.0",
  "releaseId": "deep-survival-v2.0.0",
  "programRevision": {
    "commit": "096b776b0946b8ce8d661312eeb231432e2c80e6",
    "sha256": "ca5ad9f0c9d4dfb509dedcbf8133524c15867fce5534816da21ff86a07057383"
  },
  "packageFeed": {
    "mode": "offline-local-only",
    "relativePath": "artifacts/packages/survival-v2.0.0",
    "allowNetworkRestore": false,
    "allowExternalPublication": false
  },
  "repositories": [
    {
      "name": "deep-client-maui",
      "url": "https://github.com/XPointLabs/deep-client-maui.git",
      "branch": "main",
      "sha": "d08e9371377f277575f8165bf87c8d7eb38673dd",
      "contractArtifact": {
        "name": "deep-survival-compatibility",
        "version": "2.0.0",
        "relativePath": "release/contracts/survival-compatibility-v2.0.0.json",
        "sha256": "e406625abdd99da7fd63a30cf9180e70b0c9f35d0f4f8e588b0a52294c3bc0f8"
      },
      "programRevision": {
        "commit": "096b776b0946b8ce8d661312eeb231432e2c80e6",
        "sha256": "ca5ad9f0c9d4dfb509dedcbf8133524c15867fce5534816da21ff86a07057383"
      },
      "evidenceStatus": "pinned"
    },
    {
      "name": "deep-client-shared",
      "url": "https://github.com/XPointLabs/deep-client-shared.git",
      "branch": "main",
      "sha": "94b623f078bd141163887a15116e6f9702510576",
      "contractArtifact": {
        "name": "deep-survival-compatibility",
        "version": "2.0.0",
        "relativePath": "release/contracts/survival-compatibility-v2.0.0.json",
        "sha256": "e406625abdd99da7fd63a30cf9180e70b0c9f35d0f4f8e588b0a52294c3bc0f8"
      },
      "programRevision": {
        "commit": "096b776b0946b8ce8d661312eeb231432e2c80e6",
        "sha256": "ca5ad9f0c9d4dfb509dedcbf8133524c15867fce5534816da21ff86a07057383"
      },
      "evidenceStatus": "pinned"
    },
    {
      "name": "deep-devops",
      "url": "https://github.com/XPointLabs/deep-devops.git",
      "branch": "main",
      "sha": "405b7c9304d8a33c5329242a5ad4e3a8bd7cd1dc",
      "contractArtifact": {
        "name": "deep-survival-compatibility",
        "version": "2.0.0",
        "relativePath": "release/contracts/survival-compatibility-v2.0.0.json",
        "sha256": "e406625abdd99da7fd63a30cf9180e70b0c9f35d0f4f8e588b0a52294c3bc0f8"
      },
      "programRevision": {
        "commit": "096b776b0946b8ce8d661312eeb231432e2c80e6",
        "sha256": "ca5ad9f0c9d4dfb509dedcbf8133524c15867fce5534816da21ff86a07057383"
      },
      "evidenceStatus": "pinned"
    },
    {
      "name": "deep-protocol",
      "url": "https://github.com/XPointLabs/deep-protocol.git",
      "branch": "main",
      "sha": "8484b130a274ca7d8de574e563c83198180d7808",
      "contractArtifact": {
        "name": "deep-survival-compatibility",
        "version": "2.0.0",
        "relativePath": "release/contracts/survival-compatibility-v2.0.0.json",
        "sha256": "e406625abdd99da7fd63a30cf9180e70b0c9f35d0f4f8e588b0a52294c3bc0f8"
      },
      "programRevision": {
        "commit": "096b776b0946b8ce8d661312eeb231432e2c80e6",
        "sha256": "ca5ad9f0c9d4dfb509dedcbf8133524c15867fce5534816da21ff86a07057383"
      },
      "evidenceStatus": "pinned"
    },
    {
      "name": "deep-push-notification-server",
      "url": "https://github.com/XPointLabs/deep-push-notification-server.git",
      "branch": "main",
      "sha": "dee31250b6438b9565a70f193235a28ce95f7370",
      "contractArtifact": {
        "name": "deep-survival-compatibility",
        "version": "2.0.0",
        "relativePath": "release/contracts/survival-compatibility-v2.0.0.json",
        "sha256": "e406625abdd99da7fd63a30cf9180e70b0c9f35d0f4f8e588b0a52294c3bc0f8"
      },
      "programRevision": {
        "commit": "096b776b0946b8ce8d661312eeb231432e2c80e6",
        "sha256": "ca5ad9f0c9d4dfb509dedcbf8133524c15867fce5534816da21ff86a07057383"
      },
      "evidenceStatus": "pinned"
    },
    {
      "name": "deep-registry-api",
      "url": "https://github.com/XPointLabs/deep-registry-api.git",
      "branch": "main",
      "sha": "fb7ebac6404e7a53241af08bb2f80d8a81022be8",
      "contractArtifact": {
        "name": "deep-survival-compatibility",
        "version": "2.0.0",
        "relativePath": "release/contracts/survival-compatibility-v2.0.0.json",
        "sha256": "e406625abdd99da7fd63a30cf9180e70b0c9f35d0f4f8e588b0a52294c3bc0f8"
      },
      "programRevision": {
        "commit": "096b776b0946b8ce8d661312eeb231432e2c80e6",
        "sha256": "ca5ad9f0c9d4dfb509dedcbf8133524c15867fce5534816da21ff86a07057383"
      },
      "evidenceStatus": "pinned"
    },
    {
      "name": "deep-tests-e2e",
      "url": "https://github.com/XPointLabs/deep-tests-e2e.git",
      "branch": "main",
      "sha": "da24f530f187dbd81258905bc28feedce0eb23eb",
      "contractArtifact": {
        "name": "deep-survival-compatibility",
        "version": "2.0.0",
        "relativePath": "release/contracts/survival-compatibility-v2.0.0.json",
        "sha256": "e406625abdd99da7fd63a30cf9180e70b0c9f35d0f4f8e588b0a52294c3bc0f8"
      },
      "programRevision": {
        "commit": "096b776b0946b8ce8d661312eeb231432e2c80e6",
        "sha256": "ca5ad9f0c9d4dfb509dedcbf8133524c15867fce5534816da21ff86a07057383"
      },
      "evidenceStatus": "pinned"
    },
    {
      "name": "xnode",
      "url": "https://github.com/XPointLabs/xnode.git",
      "branch": "main",
      "sha": "2980c15c1901d7569f5ba025912ab019c1058407",
      "contractArtifact": {
        "name": "deep-survival-compatibility",
        "version": "2.0.0",
        "relativePath": "release/contracts/survival-compatibility-v2.0.0.json",
        "sha256": "e406625abdd99da7fd63a30cf9180e70b0c9f35d0f4f8e588b0a52294c3bc0f8"
      },
      "programRevision": {
        "commit": "096b776b0946b8ce8d661312eeb231432e2c80e6",
        "sha256": "ca5ad9f0c9d4dfb509dedcbf8133524c15867fce5534816da21ff86a07057383"
      },
      "evidenceStatus": "pinned"
    },
    {
      "name": "xpoint-docs",
      "url": "https://github.com/XPointLabs/xpoint-docs.git",
      "branch": "main",
      "sha": "7e31f46fb21ebc0df4841caacc80bad7e6891d6e",
      "contractArtifact": {
        "name": "deep-survival-compatibility",
        "version": "2.0.0",
        "relativePath": "release/contracts/survival-compatibility-v2.0.0.json",
        "sha256": "e406625abdd99da7fd63a30cf9180e70b0c9f35d0f4f8e588b0a52294c3bc0f8"
      },
      "programRevision": {
        "commit": "096b776b0946b8ce8d661312eeb231432e2c80e6",
        "sha256": "ca5ad9f0c9d4dfb509dedcbf8133524c15867fce5534816da21ff86a07057383"
      },
      "evidenceStatus": "pinned"
    },
    {
      "name": "xpoint-node-installer",
      "url": "https://github.com/XPointLabs/xpoint-node-installer.git",
      "branch": "main",
      "sha": "22de44432024c4de10cabd815541a815cddbce80",
      "contractArtifact": {
        "name": "deep-survival-compatibility",
        "version": "2.0.0",
        "relativePath": "release/contracts/survival-compatibility-v2.0.0.json",
        "sha256": "e406625abdd99da7fd63a30cf9180e70b0c9f35d0f4f8e588b0a52294c3bc0f8"
      },
      "programRevision": {
        "commit": "096b776b0946b8ce8d661312eeb231432e2c80e6",
        "sha256": "ca5ad9f0c9d4dfb509dedcbf8133524c15867fce5534816da21ff86a07057383"
      },
      "evidenceStatus": "pinned"
    },
    {
      "name": "xpoint-staking-backend",
      "url": "https://github.com/XPointLabs/xpoint-staking-backend.git",
      "branch": "main",
      "sha": "c4638486d1f658f3cda2b5060eb3709e255d7288",
      "contractArtifact": {
        "name": "deep-survival-compatibility",
        "version": "2.0.0",
        "relativePath": "release/contracts/survival-compatibility-v2.0.0.json",
        "sha256": "e406625abdd99da7fd63a30cf9180e70b0c9f35d0f4f8e588b0a52294c3bc0f8"
      },
      "programRevision": {
        "commit": "096b776b0946b8ce8d661312eeb231432e2c80e6",
        "sha256": "ca5ad9f0c9d4dfb509dedcbf8133524c15867fce5534816da21ff86a07057383"
      },
      "evidenceStatus": "pinned"
    },
    {
      "name": "xpoint-staking-contracts",
      "url": "https://github.com/XPointLabs/xpoint-staking-contracts.git",
      "branch": "main",
      "sha": "d5063212b491b4c7bd649a3ab367491dfed9909f",
      "contractArtifact": {
        "name": "deep-survival-compatibility",
        "version": "2.0.0",
        "relativePath": "release/contracts/survival-compatibility-v2.0.0.json",
        "sha256": "e406625abdd99da7fd63a30cf9180e70b0c9f35d0f4f8e588b0a52294c3bc0f8"
      },
      "programRevision": {
        "commit": "096b776b0946b8ce8d661312eeb231432e2c80e6",
        "sha256": "ca5ad9f0c9d4dfb509dedcbf8133524c15867fce5534816da21ff86a07057383"
      },
      "evidenceStatus": "pinned"
    },
    {
      "name": "xpoint-staking-portal",
      "url": "https://github.com/XPointLabs/xpoint-staking-portal.git",
      "branch": "main",
      "sha": "1a9fa42c4f22ddebb35e299bec8856f0c151bfda",
      "contractArtifact": {
        "name": "deep-survival-compatibility",
        "version": "2.0.0",
        "relativePath": "release/contracts/survival-compatibility-v2.0.0.json",
        "sha256": "e406625abdd99da7fd63a30cf9180e70b0c9f35d0f4f8e588b0a52294c3bc0f8"
      },
      "programRevision": {
        "commit": "096b776b0946b8ce8d661312eeb231432e2c80e6",
        "sha256": "ca5ad9f0c9d4dfb509dedcbf8133524c15867fce5534816da21ff86a07057383"
      },
      "evidenceStatus": "pinned"
    }
  ]
}
