{
  "schemaVersion": "1.0.0",
  "releaseId": "deep-survival-v2.1.0-w1w2-gate-detached-local",
  "programRevision": {
    "commit": "096b776b0946b8ce8d661312eeb231432e2c80e6",
    "sha256": "ca5ad9f0c9d4dfb509dedcbf8133524c15867fce5534816da21ff86a07057383"
  },
  "packageFeed": {
    "mode": "offline-local-only",
    "relativePath": "artifacts/packages/survival-v2.0.0",
    "allowNetworkRestore": false,
    "allowExternalPublication": false
  },
  "repositories": [
    {
      "name": "deep-client-maui", "url": "https://github.com/XPointLabs/deep-client-maui.git", "branch": "survival/w00-p02d-safe-install-handoff", "sha": "c16dd8ecea4d45a994567d1ff655e8ab82a3e36e",
      "contractArtifact": { "name": "deep-survival-compatibility", "version": "2.1.0-w1w2-gate", "relativePath": "release/contracts/survival-compatibility-v2.1.0-w1w2-gate.json", "sha256": "c45f66f7a688cbd70b7ca57a777851962ce2ab59eb37a3304d9b4bf7e4c55719" },
      "programRevision": { "commit": "096b776b0946b8ce8d661312eeb231432e2c80e6", "sha256": "ca5ad9f0c9d4dfb509dedcbf8133524c15867fce5534816da21ff86a07057383" }, "evidenceStatus": "verified"
    },
    {
      "name": "deep-client-shared", "url": "https://github.com/XPointLabs/deep-client-shared.git", "branch": "survival/w00-p01-metadata-red", "sha": "fb310d05a4b8bd5450695ab00569deb62aba1ff1",
      "contractArtifact": { "name": "deep-survival-compatibility", "version": "2.1.0-w1w2-gate", "relativePath": "release/contracts/survival-compatibility-v2.1.0-w1w2-gate.json", "sha256": "c45f66f7a688cbd70b7ca57a777851962ce2ab59eb37a3304d9b4bf7e4c55719" },
      "programRevision": { "commit": "096b776b0946b8ce8d661312eeb231432e2c80e6", "sha256": "ca5ad9f0c9d4dfb509dedcbf8133524c15867fce5534816da21ff86a07057383" }, "evidenceStatus": "verified"
    },
    {
      "name": "deep-devops", "url": "https://github.com/XPointLabs/deep-devops.git", "branch": "survival/w01-p00b-w1w2-manifest", "sha": "524c5796aa868fa3d057fbf7eaa13cfea2e0d19c",
      "contractArtifact": { "name": "deep-survival-compatibility", "version": "2.1.0-w1w2-gate", "relativePath": "release/contracts/survival-compatibility-v2.1.0-w1w2-gate.json", "sha256": "c45f66f7a688cbd70b7ca57a777851962ce2ab59eb37a3304d9b4bf7e4c55719" },
      "programRevision": { "commit": "096b776b0946b8ce8d661312eeb231432e2c80e6", "sha256": "ca5ad9f0c9d4dfb509dedcbf8133524c15867fce5534816da21ff86a07057383" }, "evidenceStatus": "verified"
    },
    {
      "name": "deep-protocol", "url": "https://github.com/XPointLabs/deep-protocol.git", "branch": "survival/w01-p04-membership-contract", "sha": "db58937d4070eb057642c00d10a64d2f738f6e41",
      "contractArtifact": { "name": "deep-survival-compatibility", "version": "2.1.0-w1w2-gate", "relativePath": "release/contracts/survival-compatibility-v2.1.0-w1w2-gate.json", "sha256": "c45f66f7a688cbd70b7ca57a777851962ce2ab59eb37a3304d9b4bf7e4c55719" },
      "programRevision": { "commit": "096b776b0946b8ce8d661312eeb231432e2c80e6", "sha256": "ca5ad9f0c9d4dfb509dedcbf8133524c15867fce5534816da21ff86a07057383" }, "evidenceStatus": "verified"
    },
    {
      "name": "deep-push-notification-server", "url": "https://github.com/XPointLabs/deep-push-notification-server.git", "branch": "main", "sha": "dee31250b6438b9565a70f193235a28ce95f7370",
      "contractArtifact": { "name": "deep-survival-compatibility", "version": "2.1.0-w1w2-gate", "relativePath": "release/contracts/survival-compatibility-v2.1.0-w1w2-gate.json", "sha256": "c45f66f7a688cbd70b7ca57a777851962ce2ab59eb37a3304d9b4bf7e4c55719" },
      "programRevision": { "commit": "096b776b0946b8ce8d661312eeb231432e2c80e6", "sha256": "ca5ad9f0c9d4dfb509dedcbf8133524c15867fce5534816da21ff86a07057383" }, "evidenceStatus": "pinned"
    },
    {
      "name": "deep-registry-api", "url": "https://github.com/XPointLabs/deep-registry-api.git", "branch": "main", "sha": "fb7ebac6404e7a53241af08bb2f80d8a81022be8",
      "contractArtifact": { "name": "deep-survival-compatibility", "version": "2.1.0-w1w2-gate", "relativePath": "release/contracts/survival-compatibility-v2.1.0-w1w2-gate.json", "sha256": "c45f66f7a688cbd70b7ca57a777851962ce2ab59eb37a3304d9b4bf7e4c55719" },
      "programRevision": { "commit": "096b776b0946b8ce8d661312eeb231432e2c80e6", "sha256": "ca5ad9f0c9d4dfb509dedcbf8133524c15867fce5534816da21ff86a07057383" }, "evidenceStatus": "pinned"
    },
    {
      "name": "deep-tests-e2e", "url": "https://github.com/XPointLabs/deep-tests-e2e.git", "branch": "main", "sha": "da24f530f187dbd81258905bc28feedce0eb23eb",
      "contractArtifact": { "name": "deep-survival-compatibility", "version": "2.1.0-w1w2-gate", "relativePath": "release/contracts/survival-compatibility-v2.1.0-w1w2-gate.json", "sha256": "c45f66f7a688cbd70b7ca57a777851962ce2ab59eb37a3304d9b4bf7e4c55719" },
      "programRevision": { "commit": "096b776b0946b8ce8d661312eeb231432e2c80e6", "sha256": "ca5ad9f0c9d4dfb509dedcbf8133524c15867fce5534816da21ff86a07057383" }, "evidenceStatus": "pinned"
    },
    {
      "name": "xnode", "url": "https://github.com/XPointLabs/xnode.git", "branch": "survival/w01-p05-storage-replication-adr", "sha": "b986fe3bbbe3b47b3a13aac1e9da64e9969cb02c",
      "contractArtifact": { "name": "deep-survival-compatibility", "version": "2.1.0-w1w2-gate", "relativePath": "release/contracts/survival-compatibility-v2.1.0-w1w2-gate.json", "sha256": "c45f66f7a688cbd70b7ca57a777851962ce2ab59eb37a3304d9b4bf7e4c55719" },
      "programRevision": { "commit": "096b776b0946b8ce8d661312eeb231432e2c80e6", "sha256": "ca5ad9f0c9d4dfb509dedcbf8133524c15867fce5534816da21ff86a07057383" }, "evidenceStatus": "verified"
    },
    {
      "name": "xpoint-docs", "url": "https://github.com/XPointLabs/xpoint-docs.git", "branch": "main", "sha": "7e31f46fb21ebc0df4841caacc80bad7e6891d6e",
      "contractArtifact": { "name": "deep-survival-compatibility", "version": "2.1.0-w1w2-gate", "relativePath": "release/contracts/survival-compatibility-v2.1.0-w1w2-gate.json", "sha256": "c45f66f7a688cbd70b7ca57a777851962ce2ab59eb37a3304d9b4bf7e4c55719" },
      "programRevision": { "commit": "096b776b0946b8ce8d661312eeb231432e2c80e6", "sha256": "ca5ad9f0c9d4dfb509dedcbf8133524c15867fce5534816da21ff86a07057383" }, "evidenceStatus": "pinned"
    },
    {
      "name": "xpoint-node-installer", "url": "https://github.com/XPointLabs/xpoint-node-installer.git", "branch": "main", "sha": "22de44432024c4de10cabd815541a815cddbce80",
      "contractArtifact": { "name": "deep-survival-compatibility", "version": "2.1.0-w1w2-gate", "relativePath": "release/contracts/survival-compatibility-v2.1.0-w1w2-gate.json", "sha256": "c45f66f7a688cbd70b7ca57a777851962ce2ab59eb37a3304d9b4bf7e4c55719" },
      "programRevision": { "commit": "096b776b0946b8ce8d661312eeb231432e2c80e6", "sha256": "ca5ad9f0c9d4dfb509dedcbf8133524c15867fce5534816da21ff86a07057383" }, "evidenceStatus": "pinned"
    },
    {
      "name": "xpoint-staking-backend", "url": "https://github.com/XPointLabs/xpoint-staking-backend.git", "branch": "main", "sha": "c4638486d1f658f3cda2b5060eb3709e255d7288",
      "contractArtifact": { "name": "deep-survival-compatibility", "version": "2.1.0-w1w2-gate", "relativePath": "release/contracts/survival-compatibility-v2.1.0-w1w2-gate.json", "sha256": "c45f66f7a688cbd70b7ca57a777851962ce2ab59eb37a3304d9b4bf7e4c55719" },
      "programRevision": { "commit": "096b776b0946b8ce8d661312eeb231432e2c80e6", "sha256": "ca5ad9f0c9d4dfb509dedcbf8133524c15867fce5534816da21ff86a07057383" }, "evidenceStatus": "pinned"
    },
    {
      "name": "xpoint-staking-contracts", "url": "https://github.com/XPointLabs/xpoint-staking-contracts.git", "branch": "main", "sha": "d5063212b491b4c7bd649a3ab367491dfed9909f",
      "contractArtifact": { "name": "deep-survival-compatibility", "version": "2.1.0-w1w2-gate", "relativePath": "release/contracts/survival-compatibility-v2.1.0-w1w2-gate.json", "sha256": "c45f66f7a688cbd70b7ca57a777851962ce2ab59eb37a3304d9b4bf7e4c55719" },
      "programRevision": { "commit": "096b776b0946b8ce8d661312eeb231432e2c80e6", "sha256": "ca5ad9f0c9d4dfb509dedcbf8133524c15867fce5534816da21ff86a07057383" }, "evidenceStatus": "pinned"
    },
    {
      "name": "xpoint-staking-portal", "url": "https://github.com/XPointLabs/xpoint-staking-portal.git", "branch": "main", "sha": "1a9fa42c4f22ddebb35e299bec8856f0c151bfda",
      "contractArtifact": { "name": "deep-survival-compatibility", "version": "2.1.0-w1w2-gate", "relativePath": "release/contracts/survival-compatibility-v2.1.0-w1w2-gate.json", "sha256": "c45f66f7a688cbd70b7ca57a777851962ce2ab59eb37a3304d9b4bf7e4c55719" },
      "programRevision": { "commit": "096b776b0946b8ce8d661312eeb231432e2c80e6", "sha256": "ca5ad9f0c9d4dfb509dedcbf8133524c15867fce5534816da21ff86a07057383" }, "evidenceStatus": "pinned"
    }
  ]
}
